{
  "protocol_version": "1.1.0",
  "record_kind": "capture_invocation",
  "invocation_id": "capture-invocation_dce2d6a9-d4b6-5b4f-8a7a-906e82f25b6b",
  "session_id": "capture-session_6939dbbf-4ffb-5e86-beea-06e8fafa4a8c",
  "session_revision": 1,
  "session_digest": "f0103e048dd6fa9d9a3db656e8795e5e5b1953b85e9b3c30a5ed509e40e49cd2",
  "workflow_operation_id": "operation_01K1ABCDEFGHIJKLMNO",
  "purpose": "context_proposal",
  "invocation_key": "88bc1696c958b5d4b71a60dc51693760a219bfcb533fd2328089ec37dbe1e938",
  "binding_digests": [
    "1111111111111111111111111111111111111111111111111111111111111111",
    "2222222222222222222222222222222222222222222222222222222222222222"
  ],
  "record_digest": "fcaed27cd9ae366e0b3e1f40ba21571c05354abf19420ca64fc18e482cdfb99f"
}
